<?xml version="1.0" encoding="UTF-8"?>
<!ELEMENT dataset (ADDRESS+)>
<!ELEMENT ADDRESS EMPTY>
<!ATTLIST ADDRESS
    LASTNAME CDATA #IMPLIED
    FIRSTNAME CDATA #IMPLIED
    MIDDLENAME CDATA #IMPLIED
    PHONE CDATA #IMPLIED
    EMAIL CDATA #IMPLIED
    ADDRESS1 CDATA #IMPLIED
    ADDRESS2 CDATA #IMPLIED
    CITY CDATA #IMPLIED
    STATE CDATA #IMPLIED
    POSTALCODE CDATA #IMPLIED
    COUNTRY CDATA #IMPLIED
>
